{
  "movie": "Baahubali - The Beginning",
  "movie_slug": "baahubali_the_beginning",
  "year": 2015,
  "music_director": "M. M. Keeravani",
  "languages": [
    "telugu",
    "hindi",
    "tamil",
    "malayalam"
  ],
  "songs": [
    {
      "slug": "mamatala_talli",
      "canonical_title": "Mamatala Talli",
      "approx_duration_sec": 228,
      "versions": {
        "telugu": {
          "title": "Mamatala Talli",
          "id": "UoT_nev9",
          "duration_sec": 228,
          "singers": "",
          "album": "Baahubali - The Beginning (Telugu)"
        },
        "hindi": {
          "title": "Mamta Se Bhari",
          "id": "US0o97yr",
          "duration_sec": 228,
          "singers": "",
          "album": "Baahubali - The Beginning"
        },
        "tamil": {
          "title": "Irul Konda Vaanil",
          "id": "yhEw0E2B",
          "duration_sec": 228,
          "singers": "",
          "album": "Baahubali - The Beginning (Tamil)"
        },
        "malayalam": {
          "title": "Irul Thingum Vaanil",
          "id": "4IhIEHhJ",
          "duration_sec": 229,
          "singers": "",
          "album": "Baahubali - The Beginning"
        }
      }
    },
    {
      "slug": "jeeva_nadhi_telugu",
      "canonical_title": "Jeeva Nadhi (Telugu)",
      "approx_duration_sec": 99,
      "versions": {
        "telugu": {
          "title": "Jeeva Nadhi (Telugu)",
          "id": "AuXHr5aS",
          "duration_sec": 99,
          "singers": "",
          "album": "Baahubali - The Beginning (Telugu)"
        },
        "hindi": {
          "title": "Swapn Sunehere",
          "id": "0SxujXqZ",
          "duration_sec": 100,
          "singers": "",
          "album": "Baahubali - The Beginning"
        },
        "tamil": {
          "title": "Jeeva Nadhi (Tamil)",
          "id": "lTP3OgR1",
          "duration_sec": 99,
          "singers": "",
          "album": "Baahubali - The Beginning (Tamil)"
        },
        "malayalam": {
          "title": "Punnara Kanavine",
          "id": "Ng1WTbyL",
          "duration_sec": 100,
          "singers": "",
          "album": "Baahubali - The Beginning"
        }
      }
    },
    {
      "slug": "dhivara",
      "canonical_title": "Dhivara",
      "approx_duration_sec": 327,
      "versions": {
        "telugu": {
          "title": "Dhivara",
          "id": "0xpQY8-t",
          "duration_sec": 327,
          "singers": "",
          "album": "Baahubali - The Beginning (Telugu)"
        },
        "hindi": {
          "title": "Khoya Hain",
          "id": "qj774V-S",
          "duration_sec": 331,
          "singers": "",
          "album": "Baahubali - The Beginning"
        },
        "tamil": {
          "title": "Deerane",
          "id": "D8SAWmQk",
          "duration_sec": 327,
          "singers": "",
          "album": "Baahubali - The Beginning (Tamil)"
        },
        "malayalam": {
          "title": "Njan Chendena",
          "id": "QSwe4qW3",
          "duration_sec": 332,
          "singers": "",
          "album": "Baahubali - The Beginning"
        }
      }
    },
    {
      "slug": "sivuni_aana",
      "canonical_title": "Sivuni Aana",
      "approx_duration_sec": 197,
      "versions": {
        "telugu": {
          "title": "Sivuni Aana",
          "id": "c1kH2SKT",
          "duration_sec": 197,
          "singers": "",
          "album": "Baahubali - The Beginning (Telugu)"
        },
        "hindi": {
          "title": "Kaun Hain Voh",
          "id": "ZLW8GCUw",
          "duration_sec": 197,
          "singers": "",
          "album": "Baahubali - The Beginning"
        },
        "tamil": {
          "title": "Siva Sivaya Potri",
          "id": "yrrUQkF9",
          "duration_sec": 197,
          "singers": "",
          "album": "Baahubali - The Beginning (Tamil)"
        },
        "malayalam": {
          "title": "Aarivan Aarivan",
          "id": "dV1l-4Cn",
          "duration_sec": 198,
          "singers": "",
          "album": "Baahubali - The Beginning"
        }
      }
    },
    {
      "slug": "pacha_bottasi",
      "canonical_title": "Pacha Bottasi",
      "approx_duration_sec": 257,
      "versions": {
        "telugu": {
          "title": "Pacha Bottasi",
          "id": "F_PGOwTV",
          "duration_sec": 257,
          "singers": "",
          "album": "Baahubali - The Beginning (Telugu)"
        },
        "hindi": {
          "title": "Panchhi Bole",
          "id": "-ZqB7glb",
          "duration_sec": 259,
          "singers": "",
          "album": "Baahubali - The Beginning"
        },
        "tamil": {
          "title": "Pachchai Thee",
          "id": "OwJMKeLj",
          "duration_sec": 258,
          "singers": "",
          "album": "Baahubali - The Beginning (Tamil)"
        }
      }
    },
    {
      "slug": "manohari",
      "canonical_title": "Manohari",
      "approx_duration_sec": 216,
      "versions": {
        "telugu": {
          "title": "Manohari",
          "id": "WOVjbSrV",
          "duration_sec": 216,
          "singers": "",
          "album": "Baahubali - The Beginning (Telugu)"
        },
        "hindi": {
          "title": "Manohari",
          "id": "-pNUy45A",
          "duration_sec": 216,
          "singers": "",
          "album": "Baahubali - The Beginning"
        },
        "tamil": {
          "title": "Manogari",
          "id": "nqqJKQ3B",
          "duration_sec": 215,
          "singers": "",
          "album": "Baahubali - The Beginning (Tamil)"
        },
        "malayalam": {
          "title": "Manohari",
          "id": "M5hWNN0q",
          "duration_sec": 218,
          "singers": "",
          "album": "Baahubali - The Beginning"
        }
      }
    },
    {
      "slug": "nippulaa_swasa_ga",
      "canonical_title": "Nippulaa Swasa Ga",
      "approx_duration_sec": 191,
      "versions": {
        "telugu": {
          "title": "Nippulaa Swasa Ga",
          "id": "J2o1nrh6",
          "duration_sec": 191,
          "singers": "",
          "album": "Baahubali - The Beginning (Telugu)"
        },
        "hindi": {
          "title": "Kaun Hain Voh",
          "id": "ZLW8GCUw",
          "duration_sec": 197,
          "singers": "",
          "album": "Baahubali - The Beginning"
        },
        "tamil": {
          "title": "Moochile Theeyumaay",
          "id": "zTiF8--D",
          "duration_sec": 191,
          "singers": "",
          "album": "Baahubali - The Beginning (Tamil)"
        },
        "malayalam": {
          "title": "Theekkanal Swasamai",
          "id": "ZwDfak77",
          "duration_sec": 190,
          "singers": "",
          "album": "Baahubali - The Beginning"
        }
      }
    },
    {
      "slug": "dheevara_english_version",
      "canonical_title": "Dheevara (English Version)",
      "approx_duration_sec": 190,
      "versions": {
        "telugu": {
          "title": "Dheevara (English Version)",
          "id": "48VSLyyC",
          "duration_sec": 190,
          "singers": "",
          "album": "Baahubali - The Beginning (Telugu)"
        },
        "hindi": {
          "title": "Kaun Hain Voh",
          "id": "ZLW8GCUw",
          "duration_sec": 197,
          "singers": "",
          "album": "Baahubali - The Beginning"
        },
        "tamil": {
          "title": "Theeranae (English Version)",
          "id": "19Epzv5L",
          "duration_sec": 190,
          "singers": "",
          "album": "Baahubali - The Beginning (Tamil)"
        },
        "malayalam": {
          "title": "Theekkanal Swasamai",
          "id": "ZwDfak77",
          "duration_sec": 190,
          "singers": "",
          "album": "Baahubali - The Beginning"
        }
      }
    }
  ]
}